{
  "kind": "gridwork.agent",
  "id": "implementer-agent",
  "name": "Gridwork Implementer Agent",
  "version": "0.1.0",
  "description": "Implements approved work orders under TDD, within path scopes and allowlisted commands.",
  "mode": "afk",
  "contract": "AGENT.md",
  "allowedWorkflows": [
    "tdd-implementation",
    "feature-pr-delivery"
  ],
  "allowedSkills": [
    "github-issue-discovery",
    "diagnose-bug",
    "tdd",
    "integration-test-design",
    "integration-testing",
    "frontend-state-strategy",
    "frontend-api-contract-consumption",
    "frontend-testing-strategy",
    "git-branch-management",
    "work-order-branch-lifecycle",
    "ci-status-evaluation",
    "quality-command-contract",
    "nextjs-e2e-testing",
    "springboot-migration-testing",
    "springboot-integration-testing",
    "fastapi-migration-testing",
    "fastapi-integration-testing",
    "postgres-test-environment",
    "database-migration-verification",
    "nextjs-frontend-guidance",
    "nextjs-app-router-architecture",
    "nextjs-auth-session-guidance",
    "nextjs-data-fetching-and-cache",
    "nextjs-ui-design",
    "nextjs-performance",
    "springboot-backend-guidance",
    "springboot-performance",
    "fastapi-backend-guidance",
    "fastapi-performance",
    "postgresql-persistence-guidance",
    "postgresql-performance",
    "dockerfile-authoring",
    "docker-compose-local-guidance",
    "docker-compose-optimization",
    "handoff"
  ],
  "permissionProfile": "implementer-afk-tdd",
  "pathScopes": [
    "gridwork_factory_read",
    "factory_runtime_write",
    "product_code_scoped_write",
    "test_code_scoped_write"
  ],
  "policyRefs": [
    "../../policies/security-policy.md",
    "../../policies/logging-policy.md",
    "../../policies/path-scopes.md",
    "../../policies/agent-permissions.md",
    "../../policies/workspace-domains.md",
    "../../policies/human-gates.md",
    "../../policies/policy-precedence.md",
    "../../policies/tdd-evidence-policy.md",
    "../../policies/git-policy.md",
    "../../policies/work-order-policy.md",
    "../../policies/tool-allowlist.md",
    "../../policies/stack-skill-policy.md",
    "../../policies/frontend-delivery-policy.md"
  ],
  "handoffPolicy": "required_on_agent_or_session_transfer"
}
