{
  "kind": "gridwork.agent",
  "id": "software-architect",
  "name": "Gridwork Software Architect",
  "version": "0.1.0",
  "description": "Designs DDD architecture, API boundaries, data model guidance, ADRs and architecture diagrams from approved requirements.",
  "mode": "interactive",
  "contract": "AGENT.md",
  "allowedWorkflows": [
    "architecture-ddd"
  ],
  "allowedSkills": [
    "architecture-grill-me",
    "ubiquitous-language",
    "domain-driven-design",
    "clean-architecture",
    "architecture-pattern-selection",
    "design-pattern-selection",
    "api-contract-design",
    "relational-data-modeling",
    "architecture-decision-records",
    "integration-test-design",
    "integration-testing",
    "frontend-architecture-design",
    "frontend-state-strategy",
    "frontend-api-contract-consumption",
    "frontend-testing-strategy",
    "html-architecture-diagrams",
    "c4-html-diagrams",
    "erd-html-diagrams",
    "uml-html-diagrams",
    "backlog-planning",
    "github-actions-cicd",
    "monorepo-layout-design",
    "docker-compose-environment-strategy",
    "rollback-planning",
    "nextjs-frontend-guidance",
    "nextjs-app-router-architecture",
    "nextjs-auth-session-guidance",
    "nextjs-data-fetching-and-cache",
    "nextjs-ui-design",
    "nextjs-performance",
    "springboot-backend-guidance",
    "springboot-performance",
    "fastapi-backend-guidance",
    "fastapi-performance",
    "postgresql-persistence-guidance",
    "postgresql-performance",
    "dockerfile-authoring",
    "docker-compose-local-guidance",
    "docker-compose-optimization",
    "handoff"
  ],
  "permissionProfile": "architect-hitl",
  "pathScopes": [
    "gridwork_factory_read",
    "factory_runtime_write",
    "docs_architecture_write",
    "project_context_readonly"
  ],
  "policyRefs": [
    "../../policies/security-policy.md",
    "../../policies/logging-policy.md",
    "../../policies/path-scopes.md",
    "../../policies/agent-permissions.md",
    "../../policies/workspace-domains.md",
    "../../policies/human-gates.md",
    "../../policies/policy-precedence.md",
    "../../policies/architecture-design-policy.md",
    "../../policies/diagram-html-policy.md",
    "../../policies/stack-skill-policy.md"
  ],
  "handoffPolicy": "required_on_agent_or_session_transfer"
}
